field_order,field_type,field_id,label,description,data_source,required,placeholder,options_type,default_value
1,markdown,instructions,Instructions,"Please fill out the following fields for the **Top Level Model**.",none,false,,,
2,input,name,Name,The name of the model,none,true,"e.g., HadGEM3-GC31-HH, CESM2",,
3,input,family,Family,The name of the model family,none,true,"e.g., HadGEM3, CESM",,
4,checkboxes,components,Components,Select the processes dynamically simulated,realms,false,,dict_checkbox,
5,textarea,description,Description,"Brief scientific overview of the model including:\n\n- Main scientific purpose and application\n- Key dynamically simulated processes\n- Notable features or capabilities",none,true,"Brief scientific overview of the model and its capabilities.",,
6,checkboxes,calendar,Calendar,The calendars that define permitted dates,calendars,false,,dict_checkbox,
7,input,release_year,Release Year,Year when this model was released,none,true,"e.g., 2019, 2023",,
8,input,reference_1_doi,Primary Reference DOI,DOI for the primary model reference,none,true,https://doi.org/...,,
